<?xml version="1.0" encoding="UTF-8"?>
<!--
  Copyright (C) 2013 Andrei Olaru. See the AUTHORS file for more information.
  
  This file is part of AmIciTy-Mi.
  
  AmIciTy-Mi is free software: you can redistribute it and/or modify it under the terms of the GNU General Public License as published by the Free Software Foundation, either version 3 of the License, or any later version.
  
  AmIciTy-Mi is distributed in the hope that it will be useful, but WITHOUT ANY WARRANTY; without even the implied warranty of MERCHANTABILITY or FITNESS FOR A PARTICULAR PURPOSE.  See the GNU General Public License for more details.
  
  You should have received a copy of the GNU General Public License along with AmIciTy-Mi.  If not, see <http://www.gnu.org/licenses/>.
-->
<scen:scenario seed="-56552949266271195"
	xmlns:pr="http://www.example.org/parameterSchema" xmlns:scen="http://www.example.org/scenarioSchema"
	xmlns:ma="http://www.example.org/mapSchema" xmlns:xsi="http://www.w3.org/2001/XMLSchema-instance"
	xmlns:sel="http://www.example.org/selectionSchema"
	xsi:schemaLocation="http://www.example.org/scenarioSchema ../schemas/agent/kcaSchema.xsd ">

	<scen:map>
		<ma:features>
			<ma:coordinates>
				<ma:x>0</ma:x>
				<ma:y>0</ma:y>
			</ma:coordinates>
			<ma:size>
				<ma:width>31</ma:width>
				<ma:height>31</ma:height>
			</ma:size>
		</ma:features>
		<ma:agent>
			<ma:location>
				<ma:x>
					<pr:first>0</pr:first>
					<pr:last>30</pr:last>
					<pr:count>31</pr:count>
				</ma:x>
				<ma:y>
					<pr:first>0</pr:first>
					<pr:last>30</pr:last>
					<pr:count>31</pr:count>
				</ma:y>
			</ma:location>
		</ma:agent>
	</scen:map>

	<scen:timeline duration="1000">
		<scen:event>
			<scen:type>inject</scen:type>
			<scen:pressure>
				<pr:value>0.1</pr:value>
			</scen:pressure>
			<scen:persistence>
				<pr:value>0.05</pr:value>
			</scen:persistence>
			<scen:domain>
				<scen:a>
					<pr:value>1</pr:value>
				</scen:a>
				<scen:b>
					<pr:value>0</pr:value>
				</scen:b>
				<scen:c>
					<pr:value>0</pr:value>
				</scen:c>
			</scen:domain>
			<scen:location>
				<scen:x>
					<pr:dev>2</pr:dev>
					<pr:min>0</pr:min>
					<pr:max>30</pr:max>
					<pr:foreach>time</pr:foreach>
				</scen:x>
				<scen:y>
					<pr:dev>2</pr:dev>
					<pr:min>0</pr:min>
					<pr:max>30</pr:max>
					<pr:select>1</pr:select>
					<pr:foreach>time</pr:foreach>
					<pr:foreach>location/x</pr:foreach>
				</scen:y>
			</scen:location>
			<scen:time>
				<pr:min>0</pr:min>
				<pr:max>150</pr:max>
				<pr:select>15</pr:select>
			</scen:time>
		</scen:event>

		<scen:event>
			<scen:type>inject</scen:type>
			<scen:pressure>
				<pr:value>0.1</pr:value>
			</scen:pressure>
			<scen:persistence>
				<pr:value>0.05</pr:value>
			</scen:persistence>
			<scen:domain>
				<scen:a>
					<pr:value>0</pr:value>
				</scen:a>
				<scen:b>
					<pr:value>0</pr:value>
				</scen:b>
				<scen:c>
					<pr:value>1</pr:value>
				</scen:c>
			</scen:domain>
			<scen:location>
				<scen:x>
					<pr:dev>2</pr:dev>
					<pr:min>0</pr:min>
					<pr:max>30</pr:max>
					<pr:foreach>time</pr:foreach>
				</scen:x>
				<scen:y>
					<pr:dev>2</pr:dev>
					<pr:min>0</pr:min>
					<pr:max>30</pr:max>
					<pr:select>1</pr:select>
					<pr:foreach>time</pr:foreach>
					<pr:foreach>location/x</pr:foreach>
				</scen:y>
			</scen:location>
			<scen:time>
				<pr:dev>2</pr:dev>
				<pr:min>0</pr:min>
				<pr:max>150</pr:max>
				<pr:select>15</pr:select>
			</scen:time>
		</scen:event>
		<scen:event>
			<scen:type>inject</scen:type>
			<scen:pressure>
				<pr:value>0.1</pr:value>
			</scen:pressure>
			<scen:persistence>
				<pr:value>0.05</pr:value>
			</scen:persistence>
			<scen:domain>
				<scen:a>
					<pr:value>0</pr:value>
				</scen:a>
				<scen:b>
					<pr:value>1</pr:value>
				</scen:b>
				<scen:c>
					<pr:value>0</pr:value>
				</scen:c>
			</scen:domain>
			<scen:location>
				<scen:x>
					<pr:dev>2</pr:dev>
					<pr:min>0</pr:min>
					<pr:max>30</pr:max>
					<pr:foreach>time</pr:foreach>
				</scen:x>
				<scen:y>
					<pr:dev>2</pr:dev>
					<pr:min>0</pr:min>
					<pr:max>30</pr:max>
					<pr:select>1</pr:select>
					<pr:foreach>time</pr:foreach>
					<pr:foreach>location/x</pr:foreach>
				</scen:y>
			</scen:location>
			<scen:time>
				<pr:dev>2</pr:dev>
				<pr:min>0</pr:min>
				<pr:max>150</pr:max>
				<pr:select>15</pr:select>
			</scen:time>
		</scen:event>

		<scen:event>
			<scen:type>inject</scen:type>
			<scen:pressure>
				<pr:value>0.1</pr:value>
			</scen:pressure>
			<scen:persistence>
				<pr:value>0.02</pr:value>
			</scen:persistence>
			<scen:domain>
				<scen:a>
					<pr:value>0</pr:value>
				</scen:a>
				<scen:b>
					<pr:value>1</pr:value>
				</scen:b>
				<scen:c>
					<pr:value>0.1</pr:value>
				</scen:c>
			</scen:domain>
			<scen:location>
				<scen:x>
					<pr:value>5</pr:value>
				</scen:x>
				<scen:y>
					<pr:value>5</pr:value>
				</scen:y>
			</scen:location>
			<scen:time>
				<pr:value>70</pr:value>
			</scen:time>
		</scen:event>
		
		
		<scen:event>
			<scen:type>inject</scen:type>
			<scen:pressure>
				<pr:value>0.5</pr:value>
			</scen:pressure>
			<scen:persistence>
				<pr:value>0.95</pr:value>
			</scen:persistence>
			<scen:domain>
				<scen:a>
					<pr:value>1</pr:value>
				</scen:a>
				<scen:b>
					<pr:value>0.1</pr:value>
				</scen:b>
				<scen:c>
					<pr:value>0</pr:value>
				</scen:c>
			</scen:domain>
			<scen:location>
				<scen:x>
					<pr:min>10</pr:min>
					<pr:max>20</pr:max>
					<pr:select>1</pr:select>
					<pr:foreach>time</pr:foreach>
				</scen:x>
				<scen:y>
					<pr:min>10</pr:min>
					<pr:max>20</pr:max>
					<pr:select>1</pr:select>
					<pr:foreach>time</pr:foreach>
					<pr:foreach>location/x</pr:foreach>
				</scen:y>
			</scen:location>
			<scen:time>
				<pr:value>130</pr:value>
			</scen:time>
		</scen:event>

		<scen:event>
			<scen:type>inject</scen:type>
			<scen:pressure>
				<pr:value>0.5</pr:value>
			</scen:pressure>
			<scen:persistence>
				<pr:value>0.95</pr:value>
			</scen:persistence>
			<scen:domain>
				<scen:a>
					<pr:value>0</pr:value>
				</scen:a>
				<scen:b>
					<pr:value>1</pr:value>
				</scen:b>
				<scen:c>
					<pr:value>0.1</pr:value>
				</scen:c>
			</scen:domain>
			<scen:location>
				<scen:x>
					<pr:min>10</pr:min>
					<pr:max>20</pr:max>
					<pr:select>1</pr:select>
					<pr:foreach>time</pr:foreach>
				</scen:x>
				<scen:y>
					<pr:min>10</pr:min>
					<pr:max>20</pr:max>
					<pr:select>1</pr:select>
					<pr:foreach>time</pr:foreach>
					<pr:foreach>location/x</pr:foreach>
				</scen:y>
			</scen:location>
			<scen:time>
				<pr:value>130</pr:value>
			</scen:time>
		</scen:event>

		<scen:event>
			<scen:type>inject</scen:type>
			<scen:pressure>
				<pr:value>0.5</pr:value>
			</scen:pressure>
			<scen:persistence>
				<pr:value>0.95</pr:value>
			</scen:persistence>
			<scen:domain>
				<scen:a>
					<pr:value>0.1</pr:value>
				</scen:a>
				<scen:b>
					<pr:value>0</pr:value>
				</scen:b>
				<scen:c>
					<pr:value>1</pr:value>
				</scen:c>
			</scen:domain>
			<scen:location>
				<scen:x>
					<pr:min>10</pr:min>
					<pr:max>20</pr:max>
					<pr:select>1</pr:select>
					<pr:foreach>time</pr:foreach>
				</scen:x>
				<scen:y>
					<pr:min>10</pr:min>
					<pr:max>20</pr:max>
					<pr:select>1</pr:select>
					<pr:foreach>time</pr:foreach>
					<pr:foreach>location/x</pr:foreach>
				</scen:y>
			</scen:location>
			<scen:time>
				<pr:value>130</pr:value>
			</scen:time>
		</scen:event>

		<scen:event>
			<scen:type>inject</scen:type>
			<scen:pressure>
				<pr:value>0.9</pr:value>
			</scen:pressure>
			<scen:persistence>
				<pr:value>0.5</pr:value>
			</scen:persistence>
			<scen:domain>
				<scen:a>
					<pr:value>0.3</pr:value>
				</scen:a>
				<scen:b>
					<pr:value>0.3</pr:value>
				</scen:b>
				<scen:c>
					<pr:value>0.3</pr:value>
				</scen:c>
			</scen:domain>
			<scen:location>
				<scen:x>
					<pr:value>5</pr:value>
				</scen:x>
				<scen:y>
					<pr:value>5</pr:value>
				</scen:y>
			</scen:location>
			<scen:time>
				<pr:value>200</pr:value>
			</scen:time>
		</scen:event>
	</scen:timeline>
</scen:scenario>
